{
  "meta": {
    "title": "Per-tenant API rate limiting",
    "kind": "Tech spec",
    "version": "v1",
    "updated": "Sep 24, 2026",
    "prd": "PRD-007",
    "status": "In review",
    "ask": "Approve a Redis-backed token bucket per tenant that fails open to local buckets, and the four-stage rollout."
  },
  "summary": "Give every tenant a fair share of the public API. The gateway checks a token bucket per tenant in Redis. Tenants over their limit get 429 with Retry-After; if Redis is unavailable, the gateway falls back to local buckets so traffic keeps flowing.",
  "problem": {
    "statement": "One tenant's traffic spike can exhaust the shared Orders service. In Q2 this caused 6 incidents where every tenant saw timeouts. The only protection today is a global cap at the load balancer, which throttles all tenants equally, including the ones behaving well.",
    "metrics": [
      {
        "label": "Noisy-neighbor incidents",
        "from": "6 / quarter",
        "to": "0",
        "window": "2 quarters after launch"
      },
      {
        "label": "Other tenants' p99 during a burst",
        "from": "1.8 s",
        "to": "< 300 ms",
        "window": "measured per incident drill"
      },
      {
        "label": "False 429s (tenant under its limit)",
        "from": "n/a",
        "to": "< 0.01%",
        "window": "of all requests, weekly"
      }
    ],
    "requirements": [
      {
        "id": "R-1",
        "text": "Reject requests over a tenant's limit within 1 second of the limit being exceeded."
      },
      {
        "id": "R-2",
        "text": "Rejected requests return 429 with Retry-After and X-RateLimit-* headers."
      },
      {
        "id": "R-3",
        "text": "The limiter adds at most 2 ms to gateway p99 latency."
      },
      {
        "id": "R-4",
        "text": "A limiter or Redis failure never blocks traffic; on-call is alerted within 5 minutes."
      },
      {
        "id": "R-5",
        "text": "Per-tenant limits change without a deploy."
      }
    ],
    "nonGoals": [
      "Per-endpoint limits (v2, if tenants ask)",
      "Monthly quotas and billing (owned by the billing team)",
      "Blocking abusive IPs (handled by the WAF)"
    ]
  },
  "diagram": {
    "viewBox": "8 24 736 344",
    "nodes": [
      {
        "id": "client",
        "label": "Tenant client",
        "sub": "API key",
        "x": 80,
        "y": 195,
        "w": 120,
        "kind": "existing"
      },
      {
        "id": "gateway",
        "label": "API gateway",
        "sub": "8 replicas",
        "x": 255,
        "y": 195,
        "w": 130,
        "kind": "existing"
      },
      {
        "id": "limiter",
        "label": "Rate limiter",
        "sub": "gateway middleware",
        "x": 440,
        "y": 195,
        "w": 136,
        "kind": "new"
      },
      {
        "id": "service",
        "label": "Orders service",
        "sub": "shared by tenants",
        "x": 650,
        "y": 195,
        "w": 150,
        "kind": "existing"
      },
      {
        "id": "limits",
        "label": "Tenant limits",
        "sub": "config, hot reload",
        "x": 440,
        "y": 62,
        "w": 150,
        "kind": "new"
      },
      {
        "id": "redis",
        "label": "Redis",
        "sub": "token buckets",
        "x": 440,
        "y": 328,
        "w": 130,
        "kind": "new"
      },
      {
        "id": "fallback",
        "label": "Local fallback",
        "sub": "in-process bucket",
        "x": 255,
        "y": 328,
        "w": 150,
        "kind": "new"
      }
    ],
    "edges": [
      {
        "id": "c-g",
        "d": "M140 195 L188 195",
        "mode": "both",
        "from": "client",
        "to": "gateway"
      },
      {
        "id": "g-s",
        "d": "M320 195 L573 195",
        "mode": "before",
        "from": "gateway",
        "to": "service"
      },
      {
        "id": "g-l",
        "d": "M320 195 L370 195",
        "mode": "after",
        "from": "gateway",
        "to": "limiter"
      },
      {
        "id": "l-s",
        "d": "M508 195 L573 195",
        "mode": "after",
        "from": "limiter",
        "to": "service"
      },
      {
        "id": "l-r",
        "d": "M440 222 L440 299",
        "mode": "after",
        "from": "limiter",
        "to": "redis"
      },
      {
        "id": "l-f",
        "d": "M404 222 C 404 262, 300 262, 288 299",
        "mode": "after",
        "from": "limiter",
        "to": "fallback"
      },
      {
        "id": "l-k",
        "d": "M440 168 L440 91",
        "mode": "after",
        "dashed": true,
        "from": "limiter",
        "to": "limits"
      },
      {
        "id": "l-c",
        "d": "M420 168 C 420 112, 92 112, 92 166",
        "mode": "after",
        "ghost": true,
        "from": "limiter",
        "to": "client"
      }
    ]
  },
  "architecture": {
    "before": "Today every request goes straight from the gateway to Orders. Nothing distinguishes one tenant from another until the load balancer's global cap trips.",
    "after": "A limiter inside the gateway checks each tenant's bucket in Redis before forwarding. Limits come from hot-reloaded config (R-5). If Redis can't answer in time, a local bucket takes over (R-4)."
  },
  "scenarios": [
    {
      "id": "allowed",
      "label": "Within limit",
      "tone": "allow",
      "steps": [
        {
          "path": "c-g",
          "text": "Tenant acme sends POST /orders with its API key.",
          "state": "12 of 20 tokens",
          "meter": {
            "value": 12,
            "max": 20
          }
        },
        {
          "path": "g-l",
          "text": "The gateway resolves the tenant from the key and asks the limiter for one token.",
          "ref": "R-1",
          "state": "12 of 20 tokens",
          "meter": {
            "value": 12,
            "max": 20
          }
        },
        {
          "path": "l-r",
          "text": "One atomic Lua script in Redis refills the bucket by elapsed time and takes a token. One round trip, about 0.4 ms at p50.",
          "ref": "R-3",
          "state": "11 of 20 tokens",
          "meter": {
            "value": 11,
            "max": 20
          }
        },
        {
          "path": "l-r",
          "reverse": true,
          "text": "Token granted. 11 of 20 tokens left in acme's burst allowance.",
          "state": "11 of 20 tokens",
          "meter": {
            "value": 11,
            "max": 20
          }
        },
        {
          "path": "l-s",
          "text": "The request is forwarded to Orders with X-RateLimit-Remaining: 11.",
          "ref": "R-2",
          "state": "11 of 20 tokens",
          "meter": {
            "value": 11,
            "max": 20
          }
        }
      ],
      "stateLabel": "acme's bucket"
    },
    {
      "id": "throttled",
      "label": "Over limit",
      "tone": "throttle",
      "steps": [
        {
          "path": "c-g",
          "text": "acme is bursting: its 21st request inside one second.",
          "state": "0 of 20 tokens",
          "meter": {
            "value": 0,
            "max": 20
          }
        },
        {
          "path": "g-l",
          "text": "The gateway asks the limiter for a token.",
          "state": "0 of 20 tokens",
          "meter": {
            "value": 0,
            "max": 20
          }
        },
        {
          "path": "l-r",
          "text": "The bucket is empty. Refill rate is 20 tokens per second.",
          "state": "0 of 20 tokens",
          "meter": {
            "value": 0,
            "max": 20
          }
        },
        {
          "path": "l-r",
          "reverse": true,
          "text": "Denied. Redis reports the next token arrives in 50 ms.",
          "ref": "R-1",
          "state": "0 of 20 tokens",
          "meter": {
            "value": 0,
            "max": 20
          }
        },
        {
          "path": "l-c",
          "tone": "throttle",
          "text": "The client gets 429 with Retry-After: 1. The request never reaches Orders, so other tenants are untouched.",
          "ref": "R-2",
          "state": "0 of 20 tokens",
          "meter": {
            "value": 0,
            "max": 20
          }
        }
      ],
      "stateLabel": "acme's bucket"
    },
    {
      "id": "redis-down",
      "label": "Redis unavailable",
      "tone": "reject",
      "steps": [
        {
          "path": "c-g",
          "text": "acme sends a normal request.",
          "state": "12 of 20 tokens",
          "meter": {
            "value": 12,
            "max": 20
          }
        },
        {
          "path": "g-l",
          "text": "The gateway asks the limiter for a token.",
          "state": "12 of 20 tokens",
          "meter": {
            "value": 12,
            "max": 20
          }
        },
        {
          "path": "l-r",
          "tone": "reject",
          "text": "Redis doesn't answer within the 5 ms budget. The circuit breaker opens after 20 consecutive timeouts.",
          "ref": "R-3",
          "state": "Redis unreachable",
          "meter": null
        },
        {
          "path": "l-f",
          "tone": "throttle",
          "text": "The limiter fails open to an in-process bucket sized at the tenant limit divided by 8 replicas. Accuracy drops; availability holds.",
          "ref": "R-4",
          "state": "2 of 20 tokens",
          "meter": {
            "value": 2,
            "max": 20
          }
        },
        {
          "path": "l-s",
          "text": "The request is served. An alert fires if more than 1% of traffic uses the fallback for 5 minutes.",
          "ref": "R-4",
          "state": "2 of 20 tokens",
          "meter": {
            "value": 2,
            "max": 20
          }
        }
      ],
      "stateLabel": "acme's bucket"
    }
  ],
  "alternatives": {
    "criteria": [
      "Accuracy at window edges",